{
  "report_id": "g3-032-1",
  "gate": "G3",
  "hexagram_id": 32,
  "verifier": {
    "id": "agent-verifier",
    "name": "Agent Verifier",
    "role": "independent-verifier"
  },
  "checked_at": "2026-10-30T02:54:30Z",
  "result": "pass",
  "findings": [],
  "attachments": [],
  "producer_ids": [
    "agent-researcher"
  ]
}
