{
  "report_id": "interpretation-059-1",
  "gate": "interpretation",
  "hexagram_id": 59,
  "verifier": {
    "id": "agent-verifier",
    "name": "Agent Verifier",
    "role": "independent-verifier"
  },
  "checked_at": "2026-10-30T02:54:37Z",
  "result": "pass",
  "findings": [],
  "attachments": [],
  "producer_ids": [
    "agent-researcher"
  ]
}
